{"architecture":"x86_64","archives":[{"extracted":{"bounds":{"max_entries":100000,"max_file_bytes":2147483648,"max_total_file_bytes":8589934592},"entries":[{"gid":0,"kind":"directory","link_target":null,"mode":493,"path":"opt","sha256":null,"size":0,"uid":0},{"gid":0,"kind":"directory","link_target":null,"mode":493,"path":"opt/kata","sha256":null,"size":0,"uid":0},{"gid":0,"kind":"file","link_target":null,"mode":420,"path":"opt/kata/VERSION","sha256":"a8e4b252be4f7ab489aa165efe2fbc841eeadffeb53d34e957837c991490f033","size":7,"uid":0},{"gid":0,"kind":"directory","link_target":null,"mode":493,"path":"opt/kata/bin","sha256":null,"size":0,"uid":0},{"gid":0,"kind":"file","link_target":null,"mode":484,"path":"opt/kata/bin/cloud-hypervisor","sha256":"942917e611cdde4209a155a4b39340d2a24bcf5684190569d179a521fe779569","size":5038800,"uid":0},{"gid":0,"kind":"file","link_target":null,"mode":493,"path":"opt/kata/bin/containerd-shim-kata-v2","sha256":"a27844d941c497085194473d4b88a4c8c53d8c2ba9e0a8bad90830b6573b7f7a","size":68060136,"uid":0},{"gid":0,"kind":"file","link_target":null,"mode":484,"path":"opt/kata/bin/firecracker","sha256":"b99ea49b8d8b7bfa307d3845585d6a97f7642aa17a985749900370070d8ca930","size":2892072,"uid":0},{"gid":0,"kind":"file","link_target":null,"mode":484,"path":"opt/kata/bin/jailer","sha256":"86622337f91df329cca72bb21cd1324fb8b6fa47931601d65ee4b2c72ef2cae5","size":2280632,"uid":0},{"gid":0,"kind":"file","link_target":null,"mode":493,"path":"opt/kata/bin/kata-collect-data.sh","sha256":"9c8c19ffe2e693c7e9e218242cd3e3d93ff6309066ad07d045e9f039bbefe2fe","size":16999,"uid":0},{"gid":0,"kind":"file","link_target":null,"mode":493,"path":"opt/kata/bin/kata-monitor","sha256":"8c0b7646a1e32d3cca8eff244085efd849e1642a913b31e3b5e951cbf718f06e","size":54723104,"uid":0},{"gid":0,"kind":"file","link_target":null,"mode":493,"path":"opt/kata/bin/kata-runtime","sha256":"d24191269ee93f442b2b5f1c17dcd471f5dfffb9ed17689788f393c64021437b","size":66129144,"uid":0},{"gid":0,"kind":"file","link_target":null,"mode":493,"path":"opt/kata/bin/qemu-system-x86_64","sha256":"1e4968d9cce98c7cba8f9e3488236cba56993d9747f268d03b0284f3df2b012d","size":73358392,"uid":0},{"gid":0,"kind":"file","link_target":null,"mode":493,"path":"opt/kata/bin/qemu-system-x86_64-snp-experimental","sha256":"35b7f863eb41abafae779023139d0750622d5189c52a56adc9828e9d2cc31844","size":73336456,"uid":0},{"gid":0,"kind":"file","link_target":null,"mode":493,"path":"opt/kata/bin/qemu-system-x86_64-tdx-experimental","sha256":"e7aa34855611f295ad9d452f2d7afff88c4a558f3956ff13849d531867412be0","size":73336456,"uid":0},{"gid":0,"kind":"directory","link_target":null,"mode":493,"path":"opt/kata/include","sha256":null,"size":0,"uid":0},{"gid":0,"kind":"file","link_target":null,"mode":420,"path":"opt/kata/include/fdt.h","sha256":"0841a268996ad929ee062303409b9f1bd536c1dfce8516fc121bed3331e41f4e","size":1761,"uid":0},{"gid":0,"kind":"file","link_target":null,"mode":420,"path":"opt/kata/include/libfdt.h","sha256":"5d0c45df7f5b21e3a3e79e42b61c7c92b4be5683fe3776d317274d4bc343e6bc","size":75652,"uid":0},{"gid":0,"kind":"file","link_target":null,"mode":420,"path":"opt/kata/include/libfdt_env.h","sha256":"273bb264cacd60bb005cfa558bee084558469b9107eaf40d7e1362571ed1bc94","size":2753,"uid":0},{"gid":0,"kind":"directory","link_target":null,"mode":493,"path":"opt/kata/lib","sha256":null,"size":0,"uid":0},{"gid":0,"kind":"directory","link_target":null,"mode":493,"path":"opt/kata/lib/kata-qemu","sha256":null,"size":0,"uid":0},{"gid":0,"kind":"directory","link_target":null,"mode":493,"path":"opt/kata/lib/kata-qemu-snp-experimental","sha256":null,"size":0,"uid":0},{"gid":0,"kind":"file","link_target":null,"mode":420,"path":"opt/kata/lib/kata-qemu-snp-experimental/libfdt.a","sha256":"f552777f2f41b20036c5a609c793fa6791df453bbadc254251ed592376efb258","size":310188,"uid":0},{"gid":0,"kind":"directory","link_target":null,"mode":493,"path":"opt/kata/lib/kata-qemu-snp-experimental/pkgconfig","sha256":null,"size":0,"uid":0},{"gid":0,"kind":"file","link_target":null,"mode":420,"path":"opt/kata/lib/kata-qemu-snp-experimental/pkgconfig/libfdt.pc","sha256":"f6fd8585cc6658eef62cc775c6bd937f643c3875efb8ea1c88d72d45cc5a0c90","size":214,"uid":0},{"gid":0,"kind":"directory","link_target":null,"mode":493,"path":"opt/kata/lib/kata-qemu-tdx-experimental","sha256":null,"size":0,"uid":0},{"gid":0,"kind":"file","link_target":null,"mode":420,"path":"opt/kata/lib/kata-qemu-tdx-experimental/libfdt.a","sha256":"d7e5534cc2fec27e36ac5abb9da71fd81bb1db97aa28062b89b36dbee20b6ac3","size":310188,"uid":0},{"gid":0,"kind":"directory","link_target":null,"mode":493,"path":"opt/kata/lib/kata-qemu-tdx-experimental/pkgconfig","sha256":null,"size":0,"uid":0},{"gid":0,"kind":"file","link_target":null,"mode":420,"path":"opt/kata/lib/kata-qemu-tdx-experimental/pkgconfig/libfdt.pc","sha256":"6bc94a4ce0434adc6e5feef117ecb4bfe7016449de3eb3c7cf1709cc3dedb004","size":214,"uid":0},{"gid":0,"kind":"file","link_target":null,"mode":420,"path":"opt/kata/lib/kata-qemu/libfdt.a","sha256":"b0bbe377be5c6b5b580b460e6822d79278f77828aada6141fedc668dfac72aca","size":309852,"uid":0},{"gid":0,"kind":"directory","link_target":null,"mode":493,"path":"opt/kata/lib/kata-qemu/pkgconfig","sha256":null,"size":0,"uid":0},{"gid":0,"kind":"file","link_target":null,"mode":420,"path":"opt/kata/lib/kata-qemu/pkgconfig/libfdt.pc","sha256":"6d25259437f7460eb27ebb0d06cf757e63a078b2197707f84d34a1d3507ea123","size":197,"uid":0},{"gid":0,"kind":"directory","link_target":null,"mode":493,"path":"opt/kata/libexec","sha256":null,"size":0,"uid":0},{"gid":0,"kind":"file","link_target":null,"mode":484,"path":"opt/kata/libexec/nydusd","sha256":"73781c27e4f628481eb2338ad1c2db6cccad0e6f6f0b63d720f6d112c3eaae1a","size":18855208,"uid":0},{"gid":0,"kind":"file","link_target":null,"mode":484,"path":"opt/kata/libexec/virtiofsd","sha256":"195516c4093c0346f827e25b252cfeb5ab9432e3a1aa6c5f2ff1318d3f2c6291","size":3362176,"uid":0},{"gid":0,"kind":"directory","link_target":null,"mode":493,"path":"opt/kata/runtime-rs","sha256":null,"size":0,"uid":0},{"gid":0,"kind":"directory","link_target":null,"mode":493,"path":"opt/kata/runtime-rs/bin","sha256":null,"size":0,"uid":0},{"gid":0,"kind":"file","link_target":null,"mode":493,"path":"opt/kata/runtime-rs/bin/containerd-shim-kata-v2","sha256":"d7dae95f54cce158edc42e2de167712ab4dee3b64858a53a4e084cf851f5cb19","size":40482096,"uid":0},{"gid":0,"kind":"directory","link_target":null,"mode":493,"path":"opt/kata/share","sha256":null,"size":0,"uid":0},{"gid":0,"kind":"directory","link_target":null,"mode":493,"path":"opt/kata/share/bash-completion","sha256":null,"size":0,"uid":0},{"gid":0,"kind":"directory","link_target":null,"mode":493,"path":"opt/kata/share/bash-completion/completions","sha256":null,"size":0,"uid":0},{"gid":0,"kind":"file","link_target":null,"mode":420,"path":"opt/kata/share/bash-completion/completions/kata-runtime","sha256":"4c591e095eb3a4d97d811dbd44bba19ca7eeb021b074dc4cd577ecfa0a68c6b0","size":2247,"uid":0},{"gid":0,"kind":"directory","link_target":null,"mode":493,"path":"opt/kata/share/defaults","sha256":null,"size":0,"uid":0},{"gid":0,"kind":"directory","link_target":null,"mode":493,"path":"opt/kata/share/defaults/kata-containers","sha256":null,"size":0,"uid":0},{"gid":0,"kind":"file","link_target":null,"mode":420,"path":"opt/kata/share/defaults/kata-containers/configuration-clh-azure.toml","sha256":"f41f3d66d5938715cf6d5aed536b9668375bff94b9cbc97c55f48b548c70ef3f","size":22802,"uid":0},{"gid":0,"kind":"file","link_target":null,"mode":420,"path":"opt/kata/share/defaults/kata-containers/configuration-clh.toml","sha256":"8cce580e5abf78c05c8e9b929c24a524b9a81fc47be4e2e4f38dcae5ef052be6","size":22816,"uid":0},{"gid":0,"kind":"file","link_target":null,"mode":420,"path":"opt/kata/share/defaults/kata-containers/configuration-fc.toml","sha256":"7db1d969fa97af89c357b73f4bc9a2a29cd996905ca98c7cd2bc1fc80ff4cf05","size":18035,"uid":0},{"gid":0,"kind":"file","link_target":null,"mode":420,"path":"opt/kata/share/defaults/kata-containers/configuration-qemu-cca.toml","sha256":"a59a7a56a0c3ce262d0f0d213741b975c1953616529c99d5581e32c535915b1c","size":30957,"uid":0},{"gid":0,"kind":"file","link_target":null,"mode":420,"path":"opt/kata/share/defaults/kata-containers/configuration-qemu-coco-dev.toml","sha256":"98fd67bd58d16f15027479c2d8c3ab9678adfecc23f3c25e3152a4ae60e1a811","size":32927,"uid":0},{"gid":0,"kind":"file","link_target":null,"mode":420,"path":"opt/kata/share/defaults/kata-containers/configuration-qemu-nvidia-gpu-snp.toml","sha256":"f39f746deeaa23c953fdfb0d3a2530792a2c2f5cce9294fe98671ca9e07c95aa","size":35711,"uid":0},{"gid":0,"kind":"file","link_target":null,"mode":420,"path":"opt/kata/share/defaults/kata-containers/configuration-qemu-nvidia-gpu-tdx.toml","sha256":"95c2a5d1780f9e2249c209cd3dec831a395aaa96175daccacf33de7621227373","size":34527,"uid":0},{"gid":0,"kind":"file","link_target":null,"mode":420,"path":"opt/kata/share/defaults/kata-containers/configuration-qemu-nvidia-gpu.toml","sha256":"e860f6da339dd714c9332fa424332d07ccfff1355585c8931f8c746983b24b7a","size":34035,"uid":0},{"gid":0,"kind":"file","link_target":null,"mode":420,"path":"opt/kata/share/defaults/kata-containers/configuration-qemu-se.toml","sha256":"0af3516b63612eea0e968e0927ba60065eb3587d61e71fef5a676e17069568cb","size":32110,"uid":0},{"gid":0,"kind":"file","link_target":null,"mode":420,"path":"opt/kata/share/defaults/kata-containers/configuration-qemu-snp.toml","sha256":"e80fc3130026f7394a590ab9057c0aed1dfc2ce3eac2a647d87ba05c07b51539","size":33885,"uid":0},{"gid":0,"kind":"file","link_target":null,"mode":420,"path":"opt/kata/share/defaults/kata-containers/configuration-qemu-tdx.toml","sha256":"cb999edc7cc7ce5fc30608346536ea2df0eb5196bb8e91b656cbd80641525582","size":32702,"uid":0},{"gid":0,"kind":"file","link_target":null,"mode":420,"path":"opt/kata/share/defaults/kata-containers/configuration-qemu.toml","sha256":"7ecd072a35da55f5abc76d604a610cf3f2d543c7de0cefc4d1a81028